date,news
2023-12-05,"['Nvidia (NVDA.O) and Apple (AAPL.O) rose more than 2%, while Amazon.com (AMZN.O) and Tesla (TSLA.O) gained more than 1%.\n\nMost S&P 500 sector indexes ended down after data showed U.S. job openings dropped in October to the lowest level since early 2021, indicating that the labor market was easing.', ""Nvidia (NVDA) and Tesla (TSLA) rebounded from their 50-day lines. Microsoft (MSFT) rose slightly within the buy zone.\n\nMongoDB (MDB), Asana (ASAN), HealthEquity (HQY), Toll Brothers (TOL), SentinelOne (S) and AeroVironment (AVAV) reported Tuesday night.\n\nEarly Wednesday, Ollie's Bargain Outlet (OLLI) will release quarterly financials."", ""It's expected to formally launch its MI300 data center GPU to expand its competition with Nvidia. AMD stock dipped 0.2% to 118.38 on Tuesday, below the 21-day line. While a 122.11 cup-with-handle buy point remains technically valid, investors should probably use the Nov. 29 high of 129.73 as a new handle entry."", ""Amazon stock, Microsoft and Nvidia are on IBD Leaderboard. Apple stock and Nvidia were added to SwingTrader on Tuesday. MSFT stock is on the IBD Long-Term Leaders list. Nvidia stock, SentinelOne, MongoDB and Microsoft are on the IBD 50. Microsoft and MDB stock are on the IBD Big Cap 20.\n\nApple was Tuesday's IBD Stock Of The Day."", ""The video embedded in the article reviews Tuesday's market action and analyzes Apple stock, Amazon and Nvidia.\n\nDow Jones Futures Today\n\nDow Jones futures edged lower vs. fair value. S&P 500 futures lost a fraction and Nasdaq 100 futures fell 0.1%."", 'The Nasdaq 100 rose 0.25%, buoyed by Apple, Amazon, Nvidia, Tesla stock and more.\n\nLeading stocks generally look fine, while losing sectors were mostly just taking a pause within uptrends. One exception is the oil and gas sector.\n\nU.S. crude oil prices fell 1% to $72.32 a barrel.', ""Nvidia stock gained 2.3% to 465.66 on Tuesday, moving off its 50-day line after a three-day slide. A 476.09 double-bottom buy point is still valid, but NVDA stock has to get above its 21-day line first. It's possible that Nvidia will forge a new consolidation."", 'The AMD AI event Wednesday is important for Nvidia, which has dominated the AI chip business so far.\n\nMSFT stock edged up 0.9% to 372.52. On Monday, shares undercut the 366.78 cup-base buy point, but managed to close above that entry as well as the 21-day line.', 'Nvidia and Apple rose more than 2 per cent, while Amazon.com and Tesla gained more than 1 per cent.\n\nMost S&P 500 sector indexes ended down after data showed US job openings dropped in October to the lowest level since early 2021, indicating that the labor market was easing.']"
2023-12-06,"['Among the most important news are the new Q chatbot, an upgraded AI chip, the Trainium2, as well as the deepening of the partnership with the chipmaking leader, Nvidia Corporation (NASDAQ: NVDA). Although it still didn’t catch up with Microsoft and Google on the AI front, Amazon is coming and so is its Q chatbot designed for enterprises.', 'Nvidia fell 2.3%, while Microsoft and Amazon each lost more than 1%.\n\nWhile the S&P 500 ended lower, advancing issues in the index outnumbered decliners by a 1.3-to-one ratio.\n\nOn Friday, the more comprehensive non-farm payrolls report for November will offer greater clarity on the state of the labour market.', ""X Nvidia and Qualcomm power much of the world's technology. And with 750 chipmakers building the brains and the insides of our digital devices, competition in the sector has never been hotter. These companies and AI stocks are also a huge force on Wall Street and generate big price moves in the market."", 'Advanced Micro Devices (AMD) unveiled its latest AI chip line, taking on Nvidia (NVDA) more directly in artificial intelligence. AMD CEO Lisa Su said the market for AI chips could top $400 billion by 2027. Google parent Alphabet (GOOGL) unveiled its Gemini large language model as well as its latest in-house AI chip.', 'Nvidia stock, which nearly reclaimed its own buy point, also turned negative. Google stock fell slightly, below key levels, while Microsoft held a buy point.\n\nMicrosoft stock and Nvidia are on IBD Leaderboard and are on the IBD 50. Nvidia stock is on SwingTrader. MSFT stock is on the IBD Long-Term Leaders list.', ""Nvidia and AMD stock are major SMH holdings.\n\nReflecting more-speculative story stocks, ARK Innovation ETF (ARKK) climbed 1.3% and ARK Genomics ETF (ARKG) edged up 0.4%. Tesla stock is still a huge holding across Ark Invest's ETFs.\n\nSPDR S&P Metals & Mining ETF (XME) sank 1.2% and the Global X U.S."", ""Nvidia has the more-advanced H200 AI chip coming, but AMD's AI offerings could chip away at its dominance and pricing.\n\nAMD CEO Lisa Su now sees the AI accelerator chip market skyrocketing to above $400 billion by 2027, surging more than 70% annually over the next four years. That's more than double what AMD expected just in August."", 'Nvidia stock fell 2.3% to 455, reversing lower. At the intraday high of 473.87, NVDA stock had moved back above the 21-day line and nearly reached the still-valid 476.09 double-bottom buy point. The AI chip leader is just above its 50-day line. It may be in the process of forging a new consolidation.', 'Microsoft, a huge Nvidia AI chip buyer, was at the AMD event. The Dow Jones tech titan this month unveiled its own AI chip. That will lessen its dependence on Nvidia GPUs and third parties such as AMD.\n\nMSFT stock fell 1% to 368.80, right at the 21-day line. Shares are holding a 366.78 cup-base buy point.', 'Dow Jones Futures: S&P 500 Fades; AMD AI Chip Takes On Nvidia In $400 Billion-Plus Market']"
2023-12-07,"[""Nvidia has so far dominated the AI chip game, but Cramer said investors feel there is room for more than one player on the market. Meta and Microsoft announced Wednesday they would use AMD's newest chip, which could signal that tech companies want alternatives to Nvidia's costly graphics processors."", 'Those AI efforts will help them take on Nvidia (NVDA) and Microsoft (MSFT), respectively.\n\nAMD stock roared above multiple buy points while Google flirted with an early entry. NVDA stock also rose, around key levels. Microsoft stock edged higher within a buy zone.', ""Amazon stock, Meta, Microsoft and Nvidia are on IBD Leaderboard. Nvidia and Apple stock are on SwingTrader. MSFT stock is on the IBD Long-Term Leaders list. Microsoft and LULU stock are on the IBD 50. AMD was Thursday's IBD Stock Of The Day.\n\nDow Jones Futures Today\n\nDow Jones futures lost a fraction vs. fair value."", 'Chips had a solid session even outside AMD and Nvidia. Travel stocks fared well, with Booking Holdings (BKNG) breaking out.\n\nU.S. crude oil prices tried to bounce but closed down 4 cents to $69.34 a barrel, the lowest close since late June.', ""Nvidia and AMD stock are major SMH holdings, along with Broadcom.\n\nReflecting more-speculative story stocks, ARK Innovation ETF (ARKK) climbed 0.5% and ARK Genomic ETF (ARKG) 0.2%. Tesla stock is still a huge holding across Ark Invest's ETFs.\n\nSPDR S&P Metals & Mining ETF (XME) rose 0.4% and the Global X U.S."", ""On Wednesday, AMD unveiled a new AI chip line to take on Nvidia. But shares reversed from the buy point to close slightly lower, below the 21-day line.\n\nAnalysts generally praised AMD's new AI chip. Microsoft, Meta Platforms and OpenAI said they would buy AMD's AI accelerator, lessening their dependence on Nvidia."", ""Nvidia stock, for its part, rose 2.4% to 465.96, bouncing from its 50-day line. Shares are still below the 21-day and Thursday was an inside day to Wed.'s downside reversal. NVDA stock has a still-valid 476.09 double-bottom buy point.\n\nGoogle Stock\n\nGoogle stock leapt 5.3% to 136.93, gapping back above the 50-day."", 'Other heavyweight tech-related stocks also gained, with Nvidia and Meta Platforms rising over 2%, Amazon up 1.6% and Apple 1% higher.\n\nThe Philadelphia semiconductor index jumped 2.8%, increasing its 2023 gain to 48%, much of that fueled by bets about the future of AI.']"
2023-12-08,"[""In company news, shares of megacaps Nvidia and Meta Platforms each gained nearly 2%, while Alphabet dipped 1.4%, giving up gains after an AI-led rally in the previous session.\n\nHoneywell shed 1.6% after the industrial firm said it would buy air conditioner maker Carrier Global's security business for over $4.9 billion. Carrier's shares rose 4.5%."", 'Advanced Micro Devices (AMD) surged past buy points last week on new AI chips, challenging Nvidia (NVDA) in the huge, fast-growing artificial intelligence accelerator market. Nvidia stock, for its part, rebounded back toward a buy point and tripped some early entries. Arm Holdings (ARM) broke out of its IPO base Friday.', 'Taiwan Semiconductor (TSM), which makes chips for Nvidia, AMD, Broadcom Apple (AAPL) and many others, often from Arm chip designs, flashed an early entry Friday.\n\nMeanwhile, Tesla (TSLA) continues to trade tightly while slowly advancing toward its own aggressive entries.', ""ARM stock was added to IBD Leaderboard on Friday, joining Nvidia. Nvidia stock is on SwingTrader and the IBD 50. AMD was Thursday's IBD Stock Of The Day.\n\nDow Jones Futures Today\n\nDow Jones futures open at 6 p.m. ET on Sunday, along with S&P 500 futures and Nasdaq 100 futures."", ""Nvidia, AMD, Broadcom and TSM stock are all top-five SMH holdings.\n\nReflecting more-speculative story stocks, ARK Innovation ETF (ARKK) gained 1.55%% last week and ARK Genomics ETF (ARKG) fell 1.4%. Tesla stock is a major holding across Ark Invest's ETFs. CRSP stock also is a top Cathie Wood holding."", 'On Wednesday, AMD unveiled its new AI chip lineup to take on Nvidia. Microsoft, Meta Platforms (META) and Oracle (ORCL) are early buyers, as they seek to lessen their dependence on Nvidia GPUs.\n\nNvidia stock started the week falling to its 50-day line, but rebounded on Thursday and Friday.', ""The 'SOX' once again outperformed with +0.7%, with Broadcom +2.5%, Nvidia +2%, NXP +1.8%, Idexx Lab +1.6%.""]"
2023-12-09,"[""Nvidia Is Not the Only Company Making AI Chips -- Here Are 7 Other AI Stocks\n\nIn today's video, I discuss recent artificial intelligence (AI) updates impacting Nvidia (NASDAQ: NVDA), Advanced Micro Devices (NASDAQ: AMD), Intel (NASDAQ: INTC), and other tech stocks."", 'Nvidia Is Not the Only Company Making AI Chips -- Here Are 7 Other AI Stocks', 'In its Q3 2023 investor letter, White Brook Capital mentioned NVIDIA Corporation (NASDAQ:NVDA) and explained its insights for the company. NVIDIA Corporation (NASDAQ:NVDA) is a Santa Clara, California-based multinational technology company with a $1.1 trillion market capitalization.', 'NVIDIA Corporation (NASDAQ:NVDA) delivered a 218.64% return since the beginning of the year, while its 12-month returns are up by 191.27%. The stock closed at $465.66 per share on December 05, 2023.', 'Here is what White Brook Capital has to say about NVIDIA Corporation (NASDAQ:NVDA) in its Q3 2023 investor letter:\n\n“The magnificent seven, that underpin the S&P 500 performance, which includes NVIDIA Corporation (NASDAQ:NVDA), now comprise almost 30% of the market capitalization of the S&P500.', 'Our calculations show that NVIDIA Corporation (NASDAQ:NVDA) does not belong on our list of the 30 Most Popular Stocks Among Hedge Funds. We also mentioned NVIDIA Corporation (NASDAQ:NVDA) in another article.', 'NVIDIA Corporation (NASDAQ:NVDA) was in 180 hedge fund portfolios at the end of the second quarter of 2023, compared to 175 funds in the previous quarter. NVIDIA Corporation (NASDAQ:NVDA) delivered a -4.08% return in the past 3 months.', 'Is it a Good Move to Invest in NVIDIA Corp. (NVDA)?', 'weekly gain, its longest streak since November 2019.The Dow edged up 0.01% for the week, also its sixth straight weekly gain, its longest run of positive weeks since February 2019.The Nasdaq gained 0.69% for the week.The S&P 500 remains down 4% from its record high close in late 2021 with the Nasdaq still down 10% from its record high then.Chipmaker Nvidia']"
2023-12-10,"[""The problem with all of these AI-related stocks, including chipmakers Advanced Micro Devices and Nvidia , is the impossibility of huge percentage gains without overextending. The stocks have moved so much that they can't get you 25% gains from here, maybe not even 10%."", ""A big thank you to all the club members who showed up at the recent bottle signing for my wife's mezcal and the joy you all exhibited for the assorted wins in Nvidia, Amazon and a bunch of other stocks that have been very good to us. (See here for a full list of the stocks in Jim Cramer's Charitable Trust.)"", 'Nvidia CEO Jensen Huang plans to establish a semiconductor base in Vietnam, viewing it as a key market from which to attract global talent. With a $250 million investment in Vietnam, Nvidia plans to work with local tech companies.\n\nBack home, there’ll be a new debutant on the ASX today.', ""ChatGPT is trained and powered by products from NVIDIA Corporation (NASDAQ:NVDA) - the world's premier graphics processing unit (GPU) designer. NVIDIA's shares - and its financials - are now completely transformed from where they were a year ago. For instance, consider its share price growth and market capitalization in 2023."", 'Year to date, the shares are up by 225%, and NVIDIA is now officially part of the trillion dollar club with a market capitalization of $1.2 trillion.\n\nIts revenue during the latest fiscal quarter sat at $18.1 billion, which is simply unbelievable considering that during its fiscal year 2021, NVIDIA had raked in $16.6 billion.', '., NVIDIA earned more money during the three months ending in October 2023 than it had during the 12 months ending in January 2021. Of course back then it was reeling from a global supply slowdown in the wake of the coronavirus pandemic and was yet to capitalize on the greater demand for technology products that the pandemic had ushered in.', ""Similarly, NVIDIA is far from done, as its trailing twelve month revenue is $44.8 billion - marking a 66% growth over its latest fiscal quarter revenue.\n\nStory continues\n\nNVIDIA's meteoric rise is also mirrored by the broader semiconductor industry."", ""At the same time, even as NVIDIA is the market's A.I. darling, other semiconductor technology companies are also introducing their products. The latest such announcement came from NVIDIA's smaller rival in the GPU market, Advanced Micro Devices, Inc. (NASDAQ:AMD)."", ""Unlike NVIDIA, AMD also holds a license to make and sell x86 central processing unit (CPU) microprocessors. x86 products have been the backbone of personal computing, and AMD's Advancing AI event held in December 2023 saw it introduce a full package of A.I. products, ranging from CPUs, to GPUs, and field programmable gate arrays (FPGA).""]"
2023-12-11,"['(GOOG) (GOOGL), NVIDIA Corporation (NVDA), Amazon.com, Inc. (AMZN), and Apple Inc. (AAPL), as they are the closest in terms of market capitalization and there are many overlaps in their businesses. And up until Amazon, they all have fantastic returns on capital.', ""Meanwhile, the Magnificent Seven stocks slid Monday, with sharp losses among Meta Platforms (META), Nvidia (NVDA) and Tesla (TSLA).\n\nX\n\nThe Labor Department's CPI is out at 8:30 a.m. ET Tuesday. The CPI is expected to come in unchanged for the month of November, with an annual increase of 3.1%."", ""Meanwhile, Tesla (TSLA) skidded 1.7%, while Alphabet (GOOGL) and Nvidia were down 1.3% and 1.85%, respectively. Amazon (AMZN) declined 1%.\n\nFinally, Dow Jones tech icons Apple (AAPL) and Microsoft (MSFT) traded lower in today's stock market, with AAPL stock down 1.3% and Microsoft shares off 0.8%."", 'Zacks Investment Research\n\n\n\nImage Source: Zacks Investment Research\n\nIntel INTC: The second half of the year rally in Intel stock has been warranted as the semiconductor giant has started to regain its footing in a more competitive than ever landscape as chip companies like AMD AMD and Nvidia NVDA continue to expand from the evolution of artificial', '(AMD) : Free Stock Analysis Report\n\nNVIDIA Corporation (NVDA) : Free Stock Analysis Report\n\nTo read this article on Zacks.com click here.\n\nZacks Investment Research']"
2023-12-12,"['Dow Jones Futures Rise; Nasdaq Hits 2023 Highs, Nvidia Reclaims Buy Point With Fed On Tap', 'See the 10 stocks\n\n*Stock Advisor returns as of December 11, 2023\n\nJose Najarro has positions in Advanced Micro Devices and Nvidia. The Motley Fool has positions in and recommends Advanced Micro Devices and Nvidia. The Motley Fool has a disclosure policy.', 'Nvidia (NVDA) reclaimed a buy point, though volume remained lackluster.\n\nMicrosoft (MSFT), Amazon.com (AMZN), Netflix (NFLX), Datadog (DDOG) and Freshworks (FRSH) are stocks that have found support around their 21-day exponential moving averages.', ""Nvidia stock is the No. 1 SMH component.\n\nReflecting more-speculative story stocks, ARK Innovation ETF (ARKK) dipped 0.3% and ARK Genomics ETF (ARKG) declined 0.6%. Tesla stock remains a huge holding across Ark Invest's ETFs.\n\nSPDR S&P Metals & Mining ETF (XME) slumped 2%. U.S. Global Jets ETF (JETS) ascended 1%."", ""Nvidia Stock\n\nNvidia rose 2.2% to 476.57, just creeping back above a 476.09 double-bottom buy point. Volume was below average, a problem for NVDA stock for the past few months. For much of 2023, Nvidia was the leading stock. But it's not leading the market right now or even the chip sector."", 'Dow Jones Futures: Nasdaq Hits 2023 Highs, Nvidia Reclaims Buy Point With Fed On Tap']"
2023-12-13,"['Nvidia (NVDA) advanced a little further into a buy zone Wednesday, still buyable and now with the Fed risk factor off the table. Arm Holdings (ARM) rebounded to close back in a buy area after up-and-down trading.\n\nTesla (TSLA) undercut its 50-day line intraday on a variety of headlines, but rebounded to close slightly higher.', ""Nvidia, Arm Holdings and DDOG stock are on IBD Leaderboard. Datadog, Nvidia and NFLX stock are on SwingTrader. Nvidia stock and Datadog are on the IBD 50. Adobe stock and Datadog are on the IBD Big Cap 20. Datadog was Wednesday's IBD Stock Of The Day. FRSH stock was Tuesday's selection."", ""The VanEck Vectors Semiconductor ETF (SMH) also climbed 1.2%, with Nvidia stock the No. 1 holding.\n\nReflecting more-speculative story stocks, ARK Innovation ETF (ARKK) popped 3.7% and ARK Genomics ETF (ARKG) jumped 5.7%. TSLA stock is a major holding across Ark Invest's ETFs.\n\nSPDR S&P Metals & Mining ETF (XME) vaulted 3.7%."", ""Stocks Near Buy Points\n\nNvidia stock edged up 0.9% to 490.88, lagging the market Wednesday. But that built on Tuesday's upside reversal to back above the 476.09 double-bottom buy point, according to MarketSmith analysis.\n\nNFLX stock popped 3.7% to 479.98, clearly breaking the downtrend of a handle to offer an early entry."", '(META), Microsoft Corporation (MSFT), NVIDIA Corporation (NVDA) and Tesla, Inc. (TSLA).\n\nThis year, red-hot performance in the Magnificent Seven has dramatically impacted the complexion of the S&P 500-particularly at the top end of the food chain.', ""Many of his clients were technology companies and medical device manufacturers, including chipmaker Nvidia (NASDAQ: ) and Tyco Healthcare, now Covidien.\n\nIn one case, Donato was a lead lawyer for United Airlines in an unsuccessful private lawsuit challenging the company's $8.5 billion merger in 2010 with Continental.""]"
2023-12-14,"['Its turnover was more than double that of Nvidia, the next most traded company. The heavyweight chipmaker gained 0.5%.\n\nSectors that have underperformed this year also rose. Of the 11 S&P 500 sector indices, six closed higher, led by energy, up 2.94%, followed by a 2.62% gain in real estate .', 'See: Popular QQQ ETF on track for biggest monthly gain since July 2022 as tech stocks soar\n\nQQQ or QQQM\n\nThat said, if investors still want to own leading mega-cap tech stocks, it’s tough to beat funds such as the widely-held Invesco QQQ Trust Series I QQQ, which tracks the Nasdaq 100 and companies like Nvidia NVDA, +0.54% , Apple AAPL, +0.08% and Tesla', 'Megacap techs generally had a tough session, with Apple (AAPL), Nvidia (NVDA), Amazon.com (AMZN), Meta Platforms (META) and Google parent Alphabet (GOOGL).\n\nInsurers of various kinds struggled, along with some big pharma plays.\n\nTesla (TSLA) was the only Magnificent Seven winner of any note, flashing an early buy signal.', 'Amazon stock, Microsoft, Nvidia, Meta, ServiceNow and Datadog (DDOG) also are all on IBD Leaderboard. Apple stock, Amazon, Datadog and Nvidia are all on SwingTrader. Microsoft stock is on IBD Long-Term Leaders. Nvidia, Microsoft, Meta and ServiceNow stock are on the IBD 50. Adobe stock and Datadog are on the IBD Big Cap 20.', 'Nvidia stock climbed 0.5% to 483.50, still in range of a 476.09 double-bottom buy point.\n\nServiceNow skidded 4.9% to 680.39, but after a strong ascent from late October. Shares closed just above their 21-day line.\n\nADBE stock tumbled 6.35% to 584.64 following weak Adobe guidance for 2024.', ""If you bought Nvidia below, say, 200, you're in a much-different position than someone who bought around the latest 476.09 buy point.\n\nWhatever you do, don't chase after extended stocks. That's especially true now, with the overall market looking extended with heavy bullish sentiment.\n\nDefinitely work on your watchlists.""]"
2023-12-15,"[""Nvidia (NVDA) regained a buy point. Microsoft (MSFT), Apple (AAPL), Amazon.com (AMZN) and Meta Platforms (META) are all in buy zones. In fact, Google parent Alphabet (GOOGL) is the only Magnificent Seven stock that's not in buy range now."", 'Amazon stock, Microsoft, Nvidia, Meta are all on IBD Leaderboard. Apple stock, Amazon and Nvidia are all on SwingTrader. Microsoft stock is on IBD Long-Term Leaders. Nvidia, Microsoft, Meta stock are on the IBD 50.', ""Nvidia stock popped 2.9% to 488.90, rebounding from the 50-day line and reclaiming a 476.09 double-bottom buy point. Volume ran slightly higher on Wednesday and Friday and for the entire week, something that has been noticeably absent from Nvidia's gains in the past few months.\n\nThe tech giant may be working on a new flat base as well."", ""But Nvidia remains the AI chip leader, and will like take another step up early next year.\n\nTime The Market With IBD's ETF Market Strategy\n\nMarket Rally Analysis\n\nDo not chase after extended stocks. With the market rally running so powerfully since late October, the risks of a pullback are rising."", ""A few stocks are offering buying opportunities, including Tesla and Nvidia, but many leaders are stretched.\n\nIt's hard not to get exuberant after big gains in the market and your portfolio. But keep your emotions in check. The weekend can be a good time to look at your holdings dispassionately."", ""YOU MIGHT ALSO LIKE:\n\nBest Growth Stocks To Buy And Watch\n\nIBD Digital: Unlock IBD's Premium Stock Lists, Tools And Analysis Today\n\nHow To Invest In Magnificent Seven Stocks Like Nvidia In 2024"", 'Intel, meanwhile, marked its third straight gain after the company on Thursday launched an AI chip to compete with Advanced Micro Devices (AMD) and Nvidia (NVDA).\n\nE-signature firm DocuSign (DOCU) soared more than 11% after the Wall Street Journal reported the company is exploring a sale.', 'A few Magnificent Seven stocks outperformed, with Nvidia (NVDA), Amazon.com (AMZN) and Microsoft (MSFT) closing with gains of just over 1%.\n\nEarnings Preview: Wall Street Awaits Results From Micron, FedEx\n\nLosers outnumbered winners on the Nasdaq by less than 2-to-1. The ratio was nearly 2-to-1 negative on the NYSE.', 'Nvidia\n\nSemiconductor company Nvidia (NASDAQ:NVDA) has been one of the biggest winners on the market this year, up about 230% as of Dec. 14. In fact, it has been one of the best stocks on the planet over the past decade, with an annualized growth rate of about 62% per year over the past 10 years.', 'Nvidia specializes in manufacturing graphics processing units (GPUs) for computers, gaming consoles, and cars, as well as for high-performance computing at large data centers.', 'Nvidia is coming off a quarter where it had record revenue of $18.1 billion, up 34% from the previous quarter and 206% from a year earlier. Most of that, about $14.5 billion, a record, came from data centers. Data center revenue was up 41% in the quarter and 279% year-over-year.', 'As dominant as Nvidia has been, its growth is not expected to slow down anytime soon, as demand for its AI chips, in particular, remains sky high.', 'The amazing thing about Nvidia is that even with this year’s huge stock price increase, it is not overvalued, with a forward price-to-earnings of 24 and a five-year P/E to growth (PEG) ratio of 0.48. While investors should expect anything like a 230% increase in 2024, Nvidia is positioned for another strong year of excellent returns.\n\n2.', 'Amazon\n\nAmazon (NASDAQ:AMZN) stock is up about 74% YTD and, like Nvidia, it still has more room to run in 2024. One of the most important things Amazon did this past year was curtail expenses. In the third quarter, the increase in operating expenses was down to 5.8% year-over-year and 7.8% for the 12 months ended Sept. 30.', 'And like Nvidia, Amazon seems pretty fairly valued with a forward P/E of 39.\n\nLook for these two mega-cap monsters to keep growing in 2024.']"
